{
  "general": {
    "name": "fabr-sample"
  },
  "network": {
    "name": "default-vpc",
    "vpc": {
      "name": "default-vpc"
    },
    "domain": "acme.com"
  },
  "components": [
    {
      "name": "static-website-hosting",
      "type": "distribution",
      "subtype": "website",
      "details": [
        {
          "name": "test-static-website",
          "hostName": "staticsite",
          "domain": "test.fabrhq.dev"
        }
      ]
    }
  ],
  "services": [
    {
      "name": "ecs-farget",
      "type": "container",
      "subtype": "ecs",
      "details": [
        {
          "name": "web-service",
          "application": "PUBLIC",
          "dockerfilePath": "/test-apps/api",
          "cpu": 512,
          "mem": 2048,
          "replicas": 2
        }
      ]
    }
  ],
  "relations": [
  ]
}
