{
  "general": {
    "name": "sample"
  },
  "network": {
    "name": "main-vpc",
    "domain": "acme.com",
    "cidr": "192.168.0.0/16",
    "zones": 2,
    "subnets": [
      {
        "name": "private-subnet",
        "type": "private",
        "mask": 24
      },
      {
        "name": "public-subnet",
        "type": "public",
        "mask": 24
      }
    ]
  },
  "components": [
    {
      "name": "s3-bucket-private",
      "type": "storage",
      "subtype": "bucket",
      "details": [
        {
          "name": "fabr-bucket-1",
          "blockPublicAccess": "BlockPublicAccess.BLOCK_ALL"
        }
      ]
    }
  ],
  "services": [
  ],
  "relations": [
  ]
}
