{
  "general": {
    "name": "cdktf-sample",
    "defaultRegion": "lon",
    "defaultRegionDatacenter": "lon1"
  },
  "network": {
    "name": "unsupported"
  },
  "components": [

  ],
  "services": [
    {
      "name": "do-app",
      "type": "app",
      "subtype": "service",
      "details": [
        {
          "name": "testapi",
          "dockerfilePath": "Dockerfile",
          "dockerhubRegistryName": "janaka",
          "containerRegistryRepoName": "test-api",
          "replicas": 1
        }
      ]
    }
  ],
  "relations": []
}
