{
  "general": {
    "name": "sample"
  },
  "network": {
    "name": "main-vpc",
    "domain": "acme.com",
    "cidr": "192.168.0.0/16",
    "zones": 2,
    "subnets": [
      {
        "name": "private-subnet",
        "type": "private",
        "mask": 24
      },
      {
        "name": "public-subnet",
        "type": "public",
        "mask": 24
      }
    ]
  },
  "components": [
  ],
  "services": [
    {
      "name": "ecs-fargate",
      "type": "container",
      "subtype": "ecs",
      "details": [
        {
          "name": "web-service",
          "application": "PUBLIC",
          "contianerRrgistry": "",
          "containerImageName": "",
          "cpu": 512,
          "mem": 2048,
          "replicas": 2
        }
      ]
    }
  ],
  "relations": [
  ]
}
