{
  "general": {
    "name": "sample"
  },
  "network": {
    "name": "main-vpc",
    "domain": "acme.com",
    "cidr": "192.168.0.0/16",
    "zones": 2,
    "subnets": [
      {
        "name": "private-subnet",
        "type": "private",
        "mask": 24
      },
      {
        "name": "public-subnet",
        "type": "public",
        "mask": 24
      }
    ]
  },
  "components": [
    {
      "name": "s3",
      "type": "store",
      "subtype": "object",
      "details": [
        {
          "name": "work-bucket",
          "blockPublicAccess": "BlockPublicAccess.BLOCK_ALL"
        }
      ]
    },
    {
      "name": "sqs",
      "type": "message",
      "subtype": "queue",
      "details": [
        {
          "name": "work-queue",
          "fifo": true,
          "dlq": 1000
        }
      ]
    },
    {
      "name": "sns",
      "type": "message",
      "subtype": "topic",
      "details": [
        {
          "name": "work-topic",
          "fifo": false
        }
      ]
    },
    {
      "name": "kms",
      "type": "key",
      "subtype": "software",
      "details": [
        {
          "name": "work-key",
          "spec": "RSA_4096",
          "usage": "ENCRYPT_DECRYPT",
          "enabled": true,
          "rotation": false
        }
      ]
    }
  ],
  "services": [
    {
      "name": "ecs-farget",
      "type": "container",
      "subtype": "ecs",
      "details": [
        {
          "name": "web-service",
          "application": "PUBLIC",
          "cpu": 512,
          "mem": 2048,
          "replicas": 2
        },
        {
          "name": "task-service",
          "application": "TASK",
          "cpu": 512,
          "mem": 1024,
          "replicas": 1
        }
      ]
    }
  ],
  "relations": [
    {
      "type": "PUBLISH_TOPIC",
      "name": "web-service-publishing-topic",
      "start": "web-service",
      "finish": "work-topic",
      "bidi": false
    }, 
    {
      "type": "SUBSCRIBE_TOPIC",
      "name": "task-queue-subscribe-topic",
      "start": "work-queue",
      "finish": "work-topic",
      "bidi": false
    }, 
    {
      "type": "RECEIVE_QUEUE",
      "name": "task-service-receive-queue",
      "start": "task-service",
      "finish": "work-queue",
      "bidi": false
    }, 
    {
      "type": "ENCRYPT_KEY",
      "name": "task-service-encrypt-key",
      "start": "task-service",
      "finish": "work-key",
      "bidi": false
    }, 
    {
      "type": "DECRYPT_KEY",
      "name": "task-service-decrypt-key",
      "start": "task-service",
      "finish": "work-key",
      "bidi": false
    }, 
    {
      "type": "READ_OBJECT",
      "name": "task-service-read-object",
      "start": "task-service",
      "finish": "work-bucket",
      "bidi": false
    }, 
    {
      "type": "WRITE_OBJECT",
      "name": "task-service-write-object",
      "start": "web-service",
      "finish": "work-bucket",
      "bidi": false
    }, 
    {
      "type": "ADMIN_KEY",
      "name": "web-service-admin-key",
      "start": "web-service",
      "finish": "work-key",
      "bidi": false
    }
  ]
}
